{
  "$schema": "https://json-schema.org/draft/2020-12/schema",
  "title": "Transition@v2",
  "type": "object",
  "required": ["id", "from", "to", "relation", "timestamp"],
  "properties": {
    "id": { "type": "string", "pattern": "^[a-z0-9][a-z0-9-]{2,}[a-z0-9]$" },
    "from": { "type": "string" },
    "to": { "type": "string" },
    "relation": { "type": "string", "enum": ["causal", "alternative", "chain_next"] },
    "reason": { "type": "string" },
    "timestamp": { "type": "string", "format": "date-time" },
    "tags": { "type": "array", "items": {"type":"string"} },
    "x-extra": { "type": "object", "additionalProperties": true }
  },
  "additionalProperties": true
}
